Question,Answer
"17. What are the targets under Goal 16: Promote peaceful and inclusive societies for sustainable development, provide access to justice for all and build effective, accountable and inclusive institutions at all levels?","I don't have the specific targets under Goal 16: Promote peaceful and inclusive societies for sustainable development, provide access to justice for all and build effective, accountable and inclusive institutions at all levels."
18. What are the targets under Goal 17: Strengthen the means of implementation and revitalize the Global Partnership for Sustainable Development?,"Here are the targets under Goal 17: Strengthen the means of implementation and revitalize the Global Partnership for Sustainable Development:

1. Target 17.1: Strengthen domestic resource mobilization, including through international support to developing countries, to improve domestic capacity for tax and other revenue collection.
2. Target 17.2: Developed countries to implement fully their official development assistance commitments, including the commitment by many developed countries to achieve the target of 0.7% of gross national income for official development assistance (ODA/GNI) to developing countries and 0.15% to 0.20% of ODA/GNI to least developed countries; ODA providers are encouraged to consider setting a target to provide at least 0.20% of ODA/GNI to least developed countries.
3. Target 17.3: Mobilize additional financial resources for developing countries from multiple sources.
4. Target 17.4: Assist developing countries in attaining long-term debt sustainability through coordinated policies aimed at fostering debt financing, debt relief, and debt restructuring, as appropriate, and address the external debt of highly indebted poor countries to reduce debt distress.
5. Target 17.5: Adopt and implement investment promotion regimes for least developed countries.
6. Target 17.6: Enhance North-South, South-South, and triangular regional and international cooperation on and access to science, technology, and innovation and enhance knowledge sharing on mutually agreed terms.
7. Target 17.7: Promote the development, transfer, dissemination, and diffusion of environmentally sound technologies to developing countries on favorable terms.
8. Target 17.8: Fully operationalize the technology bank and science, technology, and innovation capacity-building mechanism for least developed countries by 2017 and enhance the use of enabling technology, in particular information and communications technology.
9. Target 17.9: Enhance international support for implementing effective and targeted capacity-building in developing countries to support national plans to implement all the Sustainable Development Goals, including through North-South, South-South, and triangular cooperation.
10. Target 17.10: Promote a universal, rules-based, open, non-discriminatory, and equitable multilateral trading system under the World Trade Organization, including through the conclusion of negotiations under its Doha Development Agenda.
11. Target 17.11: Significantly increase the exports of developing countries, in particular with a view to doubling the least developed countries’ share of global exports by 2020.
12. Target 17.12: Realize timely implementation of duty-free and quota-free market access on a lasting basis for all least developed countries, consistent with World Trade Organization decisions, including by ensuring that preferential rules of origin applicable to imports from least developed countries are transparent and simple, and contribute to facilitating market access.
13. Target 17.13: Enhance global macroeconomic stability, including through policy coordination and policy coherence.
14. Target 17.14: Enhance policy coherence for sustainable development.
15. Target 17.15: Respect each country’s policy space and leadership to establish and implement policies for poverty eradication and sustainable development.
16. Target 17.16: Enhance the Global Partnership for Sustainable Development, complemented by multi-stakeholder partnerships that mobilize and share knowledge, expertise, technology, and financial resources to support the achievement of the Sustainable Development Goals in all countries, particularly developing countries.
17. Target 17.17: Encourage and promote effective public, public-private, and civil society partnerships, building on the experience and resourcing strategies of partnerships.
18. Target 17.18: By 2020, enhance capacity-building support to developing countries, including for least developed countries and small island developing States, to increase significantly the availability of high-quality, timely, and reliable data disaggregated by income, gender, age, race, ethnicity, migratory status, disability, geographic location, and other characteristics relevant in national contexts.
19. Target 17.19: By 2030, build on existing initiatives to develop measurements of progress on sustainable development that complement gross domestic product and support statistical capacity-building in developing countries."
